<?xml version="1.0" encoding="utf-8"?>
<queries xmlns:xsi="http://www.w3.org/2001/XMLSchema-instance"
		 xsi:noNamespaceSchemaLocation="Synergy-Queries-Schema-1.1.xsd">

	<query id="loadQuestions" createdBy="David Voskanyan" implementedBy="David Voskanyan"
		   createdOn="2017-06-10">
		<dialects>
			<language name="postgre">
				<![CDATA[
				SELECT  Questions.id,
						Questions.question,
        				Questions.type,
        				SimpleAnswers.id AS answerId,
        				SimpleAnswers.answer,
        				SimpleAnswers.option,
        				SimpleAnswers.isTrueAnswer
				FROM Questions JOIN SimpleAnswers ON Questions.id = SimpleAnswers.questionId
					]]>
			</language>
		</dialects>
	</query>

	<query id="insertQuestions" createdBy="Gevorg Minasyan" implementedBy="Gevorg Minasyan"
		   createdOn="2017-06-10">
		<dialects>
			<language name="postgre">
				<![CDATA[
				INSERT INTO Questions(question, type) VALUES (?, ?)
					]]>
			</language>
		</dialects>
	</query>

	<query id="insertAnswers" createdBy="Gevorg Minasyan" implementedBy="Gevorg Minasyan"
		   createdOn="2017-06-10">
		<dialects>
			<language name="postgre">
				<![CDATA[
				INSERT INTO SimpleAnswers(questionId, answer, option, isTrueAnswer) VALUES (:questionId, :answer, :option, :trueAnswer)
					]]>
			</language>
		</dialects>
	</query>

	<query id="loadSubjects" createdBy="Gevorg Minasyan" implementedBy="Gevorg Minasyan"
		   createdOn="2017-06-11">
		<dialects>
			<language name="postgre">
				<![CDATA[
				SELECT subjectId, name
				FROM subjects
					]]>
			</language>
		</dialects>
	</query>


	<query id="loadHeadersBySubjectId" createdBy="Gevorg Minasyan" implementedBy="Gevorg Minasyan"
		   createdOn="2017-06-12">
		<dialects>
			<language name="postgre">
				<![CDATA[
				SELECT headerId, subjectId, name
				FROM headers
				WHERE subjectId = :subjectId
					]]>
			</language>
		</dialects>
	</query>

</queries>
